<?xml version="1.0" encoding="utf-8"?>
<!DOCTYPE config SYSTEM "/home/tij/Development/ChangelogTool/config-parser/src/main/resources/config.v1.dtd">
<config version="1">
    <categories>
        <category name="additions">added</category>
        <category name="refactorings">refactored</category>
        <category name="fixes">fixed</category>
        <category name="removals">removed</category>
    </categories>
    <topics>
        <entry>archive</entry>
        <entry>config parser</entry>
        <entry>markdown</entry>
        <entry>patches</entry>
        <entry>versioning</entry>
        <entry>xml-model</entry>
    </topics>
    <breaking.changes>
        <entry>major</entry>
        <entry>minor</entry>
        <entry>trivial</entry>
    </breaking.changes>
</config>